<?xml version="1.0" encoding="utf-8"?>
<RequestData xmlns:xsi="http://www.w3.org/2001/XMLSchema-instance" xsi:noNamespaceSchemaLocation="schema/diameterRequest.xsd">
	<!-- AVP Code: 263 Session-Id -->
	<!--AVP code="263" value="c1-10-99-243-34-ggsn03.ericsson.se;1302790467;86" vendor-id="0" /-->
	<AVP code="263" value="${Global.sessionID}-${Global.nowunix}-${Global.randomSession}" vendor-id="0" />
	<!-- AVP Code: 30 Called-Station-Id -->
	<AVP code="30" value="67:79:74:73:70:36:30:30:36:2e:6b:61:2e:73:77:2e:65:72:69:63:73:73:6f:6e:2e:73:65" vendor-id="0" />
	<!-- AVP Code: 260 Vendor-Specific-Application-Id -->
	<!-- Grouped data: 000001024000000c01000010 -->
	<AVP code="260" value="" vendor-id="0">
		<!-- AVP Code: 258 Auth-Application-Id -->
		<AVP code="258" value="16777232" vendor-id="0" />
		<!-- AVP Code: 266 Vendor-Id -->
		<AVP code="266" value="193" vendor-id="0" />
	</AVP>
	<!-- AVP Code: 283 Destination-Realm -->
	<AVP code="283" value="${Global.destRealm}" vendor-id="0" />
	<!-- AVP Code: 415 CC-Request-Number -->
	<AVP code="415" value="3" vendor-id="0" />
	<!-- AVP Code: 416 CC-Request-Type -->
	<AVP code="416" value="2" vendor-id="0" />
	<!-- AVP Code: 443 Subscription-Id -->
	<!-- Grouped data: 000001bc4000001234393437313132323435 -->
	<AVP code="443" value="" vendor-id="0">
		<!-- AVP Code: 444 Subscription-Id-Data -->
		<AVP code="444" value="${Global.A-Number}" vendor-id="0" />
		<!-- AVP Code: 450 Subscription-Id-Type -->
		<AVP code="450" value="0" vendor-id="0" />
	</AVP>
	<!-- AVP Code: 443 Subscription-Id -->
	<!-- Grouped data: 000001bc40000017323632343731313030303030303435 -->
	<AVP code="443" value="" vendor-id="0">
		<!-- AVP Code: 444 Subscription-Id-Data -->
		<AVP code="444" value="262471100000045" vendor-id="0" />
		<!-- AVP Code: 450 Subscription-Id-Type -->
		<AVP code="450" value="1" vendor-id="0" />
	</AVP>
	<!-- AVP Code: 456 Multiple-Services-Credit-Control -->
	<!-- Grouped data: 000001b04000000c00001900 -->
	<AVP code="456" value="" vendor-id="0">
		<!-- AVP Code: 432 Rating-Group -->
		<AVP code="432" value="6400" vendor-id="0" />
		<!-- AVP Code: 437 Requested-Service-Unit -->
		<AVP code="437" value="" vendor-id="0" />
		<!-- AVP Code: 446 Used-Service-Unit -->
		<!-- Grouped data: 0000019c4000001000000000000057f9 -->
		<AVP code="446" value="" vendor-id="0">
			<!-- AVP Code: 412 CC-Input-Octets -->
			<AVP code="412" value="22521" vendor-id="0" />
			<!-- AVP Code: 414 CC-Output-Octets -->
			<AVP code="414" value="339785" vendor-id="0" />
			<!-- AVP Code: 421 CC-Total-Octets -->
			<AVP code="421" value="362306" vendor-id="0" />
		</AVP>
		<!-- AVP Code: 1066 Charging-State-Information -->
		<AVP code="1066" value="01:01:81:02:81:03:01:02:01:03:00:04:01:ff:ff:82:13:01:00:00:00:00:ff:83:14:81:15:81:41:00:00:00:00:00:82:41:00:00:00:00:00:03:ff:ff:ff:ff:04:00:00:00:00:85:41:00:00:00:00:00:ff:02:01:03:01:04:00:ff:84:16:01:02:01:03:00:04:01:ff:85:18:01:00:00:00:00:82:19:81:1a:01:02:01:03:00:04:01:ff:82:1c:01:02:01:03:00:04:01:ff:83:1e:01:02:01:03:00:04:01:ff:84:20:01:02:01:03:00:04:01:ff:ff:ff:86:22:81:23:01:00:82:41:00:00:00:00:01:00:00:00:02:83:41:00:00:00:00:01:00:00:00:00:ff:02:01:03:01:04:00:ff:87:24:81:1d:01:00:00:02:f0:02:00:00:00:00:2a:08:7f:80:03:ff:ff:ff:fa:ff:02:01:03:01:04:00:ff:88:25:81:26:01:ff:ff:ff:ff:82:1d:01:00:00:02:f0:02:00:00:00:00:00:00:00:00:03:ff:ff:ff:fa:ff:03:00:00:00:00:00:00:00:00:ff:02:01:03:01:04:00:ff:89:27:81:34:00:00:00:00:00:02:01:03:01:04:00:ff:8a:28:81:29:81:35:00:00:00:00:11:01:00:00:00:00:00:00:00:00:00:00:00:00:00:00:00:01:82:2a:81:1b:01:00:00:00:00:00:00:00:00:ff:82:1d:01:ff:ff:ff:ff:02:00:00:00:00:00:00:00:00:03:00:00:00:00:ff:83:1f:01:00:00:00:00:00:00:00:00:02:00:00:00:00:00:00:00:00:03:00:00:00:00:00:00:00:00:ff:84:21:01:00:00:00:00:00:00:00:00:ff:ff:03:00:00:00:00:4d:ad:91:83:04:01:05:00:00:00:00:00:00:00:00:86:41:00:00:00:00:00:07:00:00:00:00:4d:ad:91:83:ff:02:01:03:01:04:00:ff:8b:2b:01:02:01:03:00:04:01:ff:8c:39:81:35:00:00:00:00:00:ff:8d:3a:01:02:01:03:00:04:01:ff:8e:3c:81:3d:01:00:01:02:00:00:03:00:00:01:2f:6e:00:67:b8:ff:02:01:03:01:04:00:ff:8f:3e:01:02:01:03:00:04:01:ff:90:43:81:44:00:45:00:00:00:00:02:ff:ff:ff:ff:ff:91:47:01:02:01:03:00:04:01:ff:ff" vendor-id="193" />
		<!-- AVP Code: 1068 Service-Session-Id -->
		<AVP code="1068" value="6400:-:2" vendor-id="193" />
	</AVP>
	<!-- AVP Code: 461 Service-Context-Id -->
	<AVP code="461" value="6.32251@3gpp.org" vendor-id="0" />
	<!-- AVP Code: 1063 Access-Information -->
	<!-- Grouped data: 000000374000000cd1581012 -->
	<AVP code="1063" value="" vendor-id="193">
		<!-- AVP Code: 55 Event-Timestamp -->
		<AVP code="55" value="${Local.nowunix}" vendor-id="0" />
		<!-- AVP Code: 258 Auth-Application-Id -->
		<AVP code="258" value="4" vendor-id="0" />
		<!-- AVP Code: 264 Origin-Host -->
		<AVP code="264" value="c1-10-99-243-34-ggsn03.ericsson.se" vendor-id="0" />
		<!-- AVP Code: 296 Origin-Realm -->
		<AVP code="296" value="ggsn03.ericsson.se" vendor-id="0" />
		<!-- AVP Code: 415 CC-Request-Number -->
		<AVP code="415" value="3" vendor-id="0" />
		<!-- AVP Code: 416 CC-Request-Type -->
		<AVP code="416" value="2" vendor-id="0" />
	</AVP>
	<!-- AVP Code: 1065 Charging-Context-Id -->
	<AVP code="1065" value="Ericsson_OCS_V1_0.0.0.7.32251@3gpp.org" vendor-id="193" />
	<!-- AVP Code: 1083 CIP-IP-Version -->
	<AVP code="1083" value="R1A" vendor-id="193" />
	<!-- AVP Code: 1164 Ericsson-QoS-Profile -->
	<!-- Grouped data: 0000048dc0000010000000c100000003 -->
	<AVP code="1164" value="" vendor-id="193">
		<!-- AVP Code: 1165 Traffic-Class -->
		<AVP code="1165" value="00:00:00:03" vendor-id="193" />
		<!-- AVP Code: 1166 Guaranteed-Bit-Rate-For-Uplink -->
		<AVP code="1166" value="512000" vendor-id="193" />
		<!-- AVP Code: 1168 Guaranteed-Bit-Rate-For-Downlink -->
		<AVP code="1168" value="512000" vendor-id="193" />
	</AVP>
</RequestData>