<?xml version="1.0" encoding="utf-8"?>
<RequestData xmlns:xsi="http://www.w3.org/2001/XMLSchema-instance" xsi:noNamespaceSchemaLocation="schema/diameterRequest.xsd">

    <!-- Origin-Host -->
    <AVP code="264" value="${Global.ownIP}" />
    
    <!-- Destination-Realm -->    
    <AVP code="283" value="${Global.destRealm}" />
    
    <!--  Origin Realm -->
    <AVP code="296" value="${Global.ownRealm}" />

    <!--  Session Id -->
    <AVP code="263" value="${Local.sessionID}.set(${Global.aIncreasingValue})" />
    
    <!-- Vendor-Specific-Application-Id -->
    <AVP code="260" value="">
        <!-- Auth-Application-Id -->
        <AVP code="258" value="${Global.AuthAppID}" />
        <!-- Vendor-Id -->
        <AVP code="266" value="${Global.destVendorID}" />
    </AVP>

    <!-- CC Request Number -->
    <AVP code="415" value="${Local.recordNumber}" />

	<!-- CC Request Type -->
	<AVP code="416" value="4" />

    <!--  Requested Action -->
    <AVP code="436" value="2" />
    
    <!-- Subscription Id -->
    <AVP code="443" value="">
        <!-- Subscription Id data -->
        <AVP code="444" value="1555666490002" />
        <!-- Subscription Id Type -->
        <AVP code="450" value="0" />
    </AVP>

    <!-- Charging Context Id -->
    <AVP code="1065" vendor-id="193" value="InternalRequest"/>

    <!-- Remote-Charging-Data -->    
    <!--      {0AccountAdjustmentService  cha1(PayloadTransactionIdd TransactionId  CommunicationId 11111    11ï¿½ï¿½ï¿½     0_1_0} -->    
    <!--     Request with both product and billing account is not allowed -->
    


<!-- BillingAccountUpdate Example: -->
<!--                 BillingAccountUpdate.BillingAccountId=11; -->
<!--                 BillingAccountUpdate.Operation=1; -->
<!--                 BillingAccountUpdate.DeltaValue=10000; -->
<!--                 BillingAccountUpdate.Decimals=2; -->

<!-- ProductAccountUpdate Example: -->
<!--                 ProductAccountUpdates.ContractId=11111; -->
<!--                 ProductAccountUpdates.ProductId=Voice; -->
<!--                 ProductAccountUpdates.ProductAccountId=11; -->
<!--                 ProductAccountUpdates.DeltaValue=10000; -->
<!--                 ProductAccountUpdates.Decimals=2; -->
<!--                 ProductAccountUpdates.Operation=1; -->
                                            
    <AVP code="1345" vendor-id="193" value="ServiceProviderId=AccountAdjustmentService;
                                            SegmentId=cha1;
                                            TransactionId=TransactionId;                                                
                                            PayloadTransactionId=TransactionId;
                                            CommunicationId=1;
                                            CustomerId=11111;
                                            ContractId=111110;
                                            
                                            BillingAccountUpdate.BillingAccountId=11;
                                            BillingAccountUpdate.Operation=1;
                                            BillingAccountUpdate.DeltaValue=10000;
                                            BillingAccountUpdate.Decimals=2;
                                            " />
            
    <!-- Remote-Charging-Data-Version -->
        <AVP code="1346" vendor-id="193" value="0_1_0" />

</RequestData>
